<?xml version="1.0" encoding="UTF-8"?>
<xs:schema xmlns:xs="http://www.w3.org/2001/XMLSchema" elementFormDefault="qualified">
<xs:element name="schedule">
    <xs:complexType>
        <xs:sequence>
            <xs:element name="flight" maxOccurs="unbounded">
                <xs:complexType>
                    <xs:sequence>
                        <xs:element name="id" type="xs:integer"/>
                    </xs:sequence>
                </xs:complexType>
            </xs:element>
        </xs:sequence>
    </xs:complexType>
</xs:element>
</xs:schema>
