<?xml version="1.0" encoding="UTF-8"?>
<schedule xmlns:xsi="http://www.w3.org/2001/XMLSchema-instance"
    xsi:noNamespaceSchemaLocation="../../XMLSchema/schedule.xsd">
    <flight>
        <id>1</id>
    </flight>
    <flight>
        <id>2</id>
    </flight>
    <flight>
        <id>3</id>
    </flight>
    <flight>
        <id>4</id>
    </flight>
    <flight>
        <id>5</id>
    </flight>
</schedule>